contents,titles,urls
"While the most powerful robots are still , millions of years of evolution has made animals masters of tricky terrain. To take advantage of this scientists are exploring ways to augment living animals with robotic systems, and now a team from the Korea Advanced Institute of Science and Technology (KAIST) has used a ""parasitic robot"" to control the movements of a live turtle by feeding it treats., , and  have all gotten the cyborg treatment in the past, allowing scientists to take advantage of their natural talents. After all, why build a drone from scratch that can hover and zip around at high speeds when a dragonfly can already do just that? By the same logic, a turtle is already adept at crawling over rocky ground and swimming, so it's more straight forward to just build a system to control the animals.A few months ago, the KAIST team was  with having a human user send instructions to steer the turtle just by thinking ""left"" or ""right,"" but this new iteration instead allows the creatures to autonomously move towards a target. It makes use of what the team calls a ""parasitic robot"" attached to the turtle's shell and programmed to move to a given waypoint. Turtles naturally move towards sources of light, so to direct the animal the robot flashes an LED in front of its face. When the turtle moves in the right direction, the robot reinforces the behavior by feeding it a little treat. After a training period of five weeks, the team says the dynamic duo of robot and turtle were able to move around a water tank to reach changing waypoints with ease. In future, other animals like mice, birds and fish could be fitted with similar systems for a range of exploration and reconnaissance missions. ""This hybrid animal-robot interaction system could provide an alternative solution to the limitations of conventional mobile robot systems in various fields, and could also act as a useful interaction system for the behavioral sciences,"" says Dae-Gun Kim, first author of the study.The research was published in the . Source: ","""Parasitic robot"" tosses treats to steer a cyborg turtle",https://newatlas.com/parasitic-robot-cyborg-turtle/49729/
"Butterfly wing material is somewhat like , in that they’re both animal-produced substances which scientists are very interested in copying. In the case of butterfly wings, it’s their ability to brilliantly reflect light in a variety of iridescent colors that could prove particularly useful to humans. Researchers from the Korea Advanced Institute of Science and Technology (KAIST) are reporting success in replicating the reflective properties of the insects’ wings, using tiny glass beads.Prof. Shin Jung Hoon led the team, which set out to copy the wings of the morpho butterfly. According to the researchers, the secret to the morpho’s striking wings is that their reflective microstructure is at once ordered and chaotic. Analyzed at the 100-nanometer level, the structure is in disarray. Zoom out to the 1-micrometer level, however, and it becomes uniform.The scientists replicated this arrangement by first randomly aligning glass beads of various sizes, although all of them measured approximately a few hundred nanometers across. That took care of the chaotic structure. Then, they used a semiconductor deposition process to deposit a thin film over top of the beads. This made the structure appear ordered when viewed as a whole. They sealed the resulting film in thin clear plastic, to protect it and give it more structure.The finished product was said to produce a better quality and brightness of reflected light than the butterfly wings themselves. Additionally, the color of the film changes less than that of the wings, when viewed from different angles.Down the road, the technology could find use in anti-counterfeit currency, ultra-bright mobile device displays, sensors, or even the fashion industry. KAIST isn’t the first institution to copy the reflective qualities of butterfly wings, however. A joint  team has had success, as has a group from the  – although using different techniques.Source: ",Glass beads used to mimic butterfly wings,https://newatlas.com/glass-bead-butterfly-wings/22483/
"The  (DRC) has come to a close with South Korea's Team KAIST and its DRC-HUBO robot taking first prize in the US$3.5 million competition. The US Department of Defense's project to develop robots that can help responders in disaster areas saw KAIST beat 23 other teams from around the world in front of a crowd of 10,000 people.On Saturday, as on the , the action involved robots running a series of simultaneous heats where they negotiated a course while executing a series of eight tasks that simulated working in a disaster area. The tasks included driving a car, opening a door, operating a valve, and climbing a flight of stairs. To prevent the teams from pre-programming the robots to run the course, a surprise task was included, which on the final day of the two-day competition required the robots to remove an electrical plug from a socket and set it in a different socket.Under intense Californian sunshine, the final day of the Challenge saw the competition upped a notch. Since damage to the robots that would put them out of the running was no longer a factor, the teams took more chances and robots fell more often.Team Aist Nedo performed very well until the debris challenge, but just when the anime-styled robot HRP2+ stepped off the debris field for a point, it toppled onto cinder blocks, bursting open its torso and spewing components.Another challenger that was initially doing well was Team Robotis' Thormang 2 ... until it fell unexpectedly and lost its head while tackling the surprise task. The robot had unplugged a wire and was sorting out how to plug it into the other socket, then quietly toppled over and hit its head on the wall, knocking it loose.Falling over was a common occurrence with so many bipedal robots competing, and some were even sporting foam shoulder pads to protect their delicate arm mechanisms. Many times the falls would happen while the robots were navigating the debris field or climbing the stairs, but sometimes it would be an almost surreal event, like when Lockheed Team Trooper's Leo opened the door, paused, then calmly fell to the ground as if it had decided to have a quick nap.It's interesting to note that the robots were required to stand up on their own or face a ten minute penalty, but for all the falling, only Tartan Rescue's Chimp managed to get back to its feet on the first day and none did so on the second. Behind the wheel, team Vigir's eponymous robot did its own take on self-driving cars when it crashed its Polaris two-seater into a traffic barrier during the driving challenge. Crash-test robots weren't the only spectacle either – between the heats, as the next robots were wheeled out and prepared, Boston Dynamic's  gamboled on the track in an impressive and alarmingly lifelike display of robotic agility. By the afternoon, teams that had finished the competition were doing post mortems back in the cavernous ""garage,"" where many of them had been living 24 hours a day throughout the Challenge. Robots were in various states of repair. Some were back in tethers and taking steps under the watchful eye of engineers like patients in an accident ward, some were almost completely disassembled, some seemed abandoned by their makers, and others were posed as either educational or humorous exhibits. The last few teams, the heavy hitters with high point scores, were still preparing with last minute test runs and system checks.The general atmosphere was for the most part one of elation, given the huge task the teams faced to make it to the competition in the first place. This was a sentiment shared by both high-scoring teams and those whose robots never got further than the first task – this was a matter of building robots that were like nothing seen before, and just getting them to the point where they could attempt the DARPA course was a major achievement.Meanwhile the competition wound down to its conclusion, which while not exactly suspenseful, was certainly appreciated by the large crowd.Team WPI-CMU's Warner was a crowd pleaser and looked like it would have a very good second day until the hole cutting task. The robot managed to pick up and activate two cordless drills only to drop both, forcing it to abandon the task.This sort of difficulty is an illustration of the nature of the challenge. With the operators for each team confined to a building a quarter of a mile away and linked to their robot by a deliberately degraded communications system, they had to deal with significant time lags a very limited ability to control the machine. Therefore, the robots had to be built with a high degree of autonomy, which the team engineers told us was the greatest part of the challenge. They had to build software that told the robot to carry out whole tasks and decide for itself how to do them. Precise teleoperation simply wasn't an option.This was obvious when Team Robosimian took to the field. The robot, which resembles a cross between a spider and an ape, recovered neatly from a drill problem, but flubbed the surprise task when it lost its gap on the plug and backed away until it dropped it. Watched the plug slowly slide out of the robot’s open claw must have been agonizing for the operators when a simple command to close it would have saved the day.It was clear by the last round that first prize would go to Team KAIST's DRC-HUBO robot and that the likely challengers weren't going to deliver an upset. DRC-HUBO is the latest of the ""HUmanoid roBOt (HUBO) robots developed by the  in collaboration with the Rainbow Company since 2002. DRC-HUBO gains some of its advantage from  its unique leg design. Instead of just walking, it can also transform into a rolling mode. When it kneels, the lower limbs turn into a stable platform with wheels on the ankles and knees to propel it at relatively high speed. With its modified humanoid hybrid design and lightweight aluminum construction, KAIST says that it improves on previous versions, is more powerful, has stronger hands, and is programed with a new walking algorithm. In addition, all motors are equipped with cooling fans.The final scores for the 2015 DRC Final saw Team KAIST taking the US$2 million first prize with 8 points and a time of 44:28. Second was Team IHMC Robotics's Running Man robot with 8 points and a time of 50:26. Tartan Rescue's Chimp, which won the first day of competition, came third with 8 points and a time of 55:15.The video below shows Team KAIST winning the 2015 DRC Final.For more information, visit the  site.",South Korea's Team KAIST wins 2015 DARPA Robotics Challenge,https://newatlas.com/darpa-drc-finals-2015-results-kaist-win/37914/
"Researchers at the Korean Advanced Institute of Science and Technology (KAIST) have developed a new indoor positioning system that makes it possible to build a Wi-Fi radio map that does not require GPS signals. It's claimed to be an improvement on , that rely on both GPS and Wi-Fi signals.The system consists of a set of Wi-Fi LAN signals captured by a mobile device, and the measurements of received Wi-Fi signal strengths (RSSs) from access points surrounding the device. The Wi-Fi radio map shows the RSSs of Wi-Fi access points at different locations in a given environment, so each ""Wi-Fi fingerprint"" on the radio map is linked to data on location.For their research, the KAIST team collected fingerprints from users' smartphones every 30 minutes for a week, through modules embedded in mobile platforms, utilities or applications. After that, they analyzed the characteristics of the collected fingerprints based on the users’ home and office addresses as location references. Then they classified the fingerprints collected from the phones according to one of those two locations.Using Google’s geocoding, Prof. Dong-Soo Han converted each home and office address into geographic coordinates to obtain the location of the collected fingerprints. The Wi-Fi radio map has both the fingerprints and coordinates, whereby the location of the phones can be identified or tracked.In order to test the method, the research team collected 7,000 Wi-Fi fingerprints at 400 access points in each of four selected areas in Korea. They were careful to choose a mix of commercial and residential locations to collect data for the Wi-Fi radio map. The researchers realized that the more data they collected, the more accurately they could determine location. With a collection rate of 50 percent (that is, with every other house or office in the area covered), the margin of error was not more than 10 meters (32.8 ft).The KAIST researchers want a non-GPS alternative because GPS signals do not work well in indoor spaces or between high-rise buildings, as they lose two-thirds of their accuracy in vertical configurations – they need a clear view of the sky to communicate with satellites.The researchers still need to deal with privacy protection issues before launching the method commercially, but they believe that once the address-based radio map is fully developed for commercial use, it will be useful for a variety of applications. These could include emergency rescue or tracking of lost cell phones, missing persons, or survivors during fires.Source: ",KAIST develops new Wi-Fi indoor positioning system,https://newatlas.com/kaist-ips-wifi/25637/
"Public transport systems offer many advantages over the personal alternatives when it comes to getting large numbers of people from A to B in style and safety - less congestion, less pollution and lower costs for starters. But while we certainly see plenty of impetus on the personal transport front here at Gizmag, fresh concepts for the future of mass transport don't seem to enjoy the same level of exposure, despite the fact that many cities around the world are still saddled with public transport infrastructure that's been in place for over a century. There are some radical plans in the works, however, and the 21st Century will undoubtedly bring with it a raft of people moving projects that redefine our notion of public transport. So just what will be pulling into the station in 50 years time? Read on for our pick of the most tantalizing concepts out there.While fast, frictionless maglev train systems have been operational for decades, they haven't exactly become ubiquitous - perhaps because of the cost of the systems, or perhaps because there is no compelling need to replace the already widespread and workable conventional railway infrastructure. Either way, the idea is not about to fade from our collective imagination and several maglev of the future concepts have been floated.The  system envisions superconducting maglev trains operating in evacuated tubes at speeds of up to 6,500 km/h (4,039 mph) on international trips - that's New York to Beijing in two hours! The proponents of this system say that ET3 could be 50 times more efficient than electric cars or trains. goes even further than ultra-efficient mass transport with its vision for a network of superconducting tunnels. As well as providing infrastructure for ""Terraspan trains,"" this network would also facilitate zero loss transmission of electricity to our homes.A 500 km/h (310 mph) vacuum train project has also been proposed for Switzerland, but as the  site outs it: ""So a far-advanced technology of and for the next generation remains in the drawer.""Another high-speed rail concept that aims to present an alternative to conventional systems without the astronomical price tag is Anatoly Unitsky's . The concept is based on the use of what look like heavy-duty above ground electrical wires, but instead of carrying power, these high-tension wires become the support for carriages.The proponents of the system see big advantages in terms of cost (somewhere between three and 10 times less expensive than a railway, maglev system, monorail system or motorway) and efficiency (an 80 kW (107hp) motor would take a 20-person passenger vehicle up to 155 mph (250 km/h)).Taking the above ground rail concept further (and then turning it on its head) is Robert C. Pulliam's . In this system the trains themselves carry the tracks, while the wheels and motors are contained in elevated rings that the train passes through at speeds of up to 240 km/h (150 mph). Because the design would cause minimal disruption to existing infrastructure and the technology is readily available, Tubular Rail estimates that construction costs could be 60 percent less than conventional urban train networks.This is definitely one of the most interesting public transportation concepts we've encountered over the years when it comes to reducing urban congestion, while making use of existing infrastructure. The """" would roll on stilts  traffic using small tracks positioned between lanes of traffic while passengers get on and off at elevated bus stops. The result: additional people carrying capacity for urban roads, no disruption to traffic and no need to build completely independent track systems. Seems like a win/win, but at this stage we're not aware of any progress on the expected pilot program.Another outside-the-box approach to transport that deserves a place in our top 10 is the . This human powered monorail system uses bicycle pods suspended from tracks to create a very efficient option for getting from A to B.Currently you can ride the Shweeb at the Agroventures in New Zealand where you can reach speeds of up to 45 km/h (28 mph) under your own steam. The idea is not limited to adventure parks though. Shweeb picked up a US$1 million investment from Google in 2010 as part of Project 10^100 and the  it will soon be announcing the planned location of the first Shweeb built for public use.The quest for more efficient transport systems doesn't necessarily have to come at the cost of speed. The  is a campaign aiming to bring high-speed (we're talking 220 mph (354 km/h)) trains to Arizona using tracks equipped with solar panel carrying canopies that would provide the 110 megawatts of electricity that the system needs to run. The  is currently in the R&D phase but faces several hurdles (not the least of which is an estimated US$27 billion pricetag) before construction of the planned Tucson to Phoenix line can get underway.While on the subject, solar isn't the only alternative energy being considered for powering train networks. The  envisions turbines incorporated into tracks that could be used to harness wind energy from the train as it whooshes overhead.While  that allow personal electric vehicles to recharge on the go are gathering momentum, these systems also hold potential for making mass transportation greener and more efficient. A real-world example of this technology has already been demonstrated in the form of a  developed by researchers at the Korea Advanced Institute of Science and Technology (KAIST). The pilot project in Seoul’s Grand Park in Gwacheon City involved running an engine and three passenger cars using power supply infrastructure buried under the ground in sections of a 2.2 km (1.36 mile) long track.So why not just charge the electric train at the socket? The advantage here is that the vehicle can operate with a battery that's one-fifth of the the size of batteries installed in electric vehicles currently on the market. While this means gains in efficiency, this needs to be weighed against the loss in efficiency caused by contactless charging, which in the KAIST experiment peaked at 74 percent. KAIST hopes to commercialize this technology within the next few years.These days we think of road and rail transport as completely different things, but this distinction is set to become a little muddy as technology marches towards 2050. One of the benefits of public transport in general is that it avoids the inherent chaos of personal transport where the decisions are made by individual drivers. ""Follow-the-leader"" systems are looking to solve this problem by using a lead vehicle that's wirelessly linked to a series of other cars or ""carriages"" which follow its path autonomously. The system retains the flexibility of purely private transport (i.e. vehicles can leave the train so that you don't all have to end up at the same destination), the only additional infrastructure required is the computers that link the vehicles and the benefits for road safety, decreasing congestion and reducing vehicle fuel consumption are obvious.This best of both world's idea sits in the ""very near future"" category - a European project dubbed  (Safe Road Trains for the Environment) project has been in progress since 2009 and was recently  for the first time.Some future transport concepts have loftier goals that just getting us to the station on time. While  based on more conventional rocket ships is a fast growing infant, there are also plans afoot to use ""space trains"" to launch passengers into orbit.Like the EET discussed above, the  system would use a superconducting, magnetically levitating train capsule in a vacuum tube. The difference here is that the final 12 miles (20 km) of the 1,000 mile (1,609 km) long track would point upwards, launching the ""carriage"" into low earth orbit. If that's not futuristic enough, the plan sees the skywards pointing launch tube itself being held in place by magnetic levitation!Conceived by Dr. George Maise along with one of the inventors of superconducting maglev, Dr. James Powell, the potential of this system to significantly reduce the costs of putting commercial cargo (and space tourists) into orbit is attracting serious discussion.Another long standing and noteworthy concept that aims to democratize the process of getting off the planet is the space elevator. First theorized over 100 years ago, the idea of the space elevator is to use a cable tethered to a base station to send ""climbers"" into orbit at a fraction of the cost of rocket-based launch systems.While there are a variety of designs, the key component of a working space elevator would be a thin tether made from lightweight material (carbon nanotubes are the prime candidate) that stretches from an anchor point or base station on or near the Earth's equator to a point some 60,000 miles (96,560 km) into space. The Earth's rotation and a counterweight on the upper end of the cable would keep the line taught and climbers (likely powered by solar energy) traveling at fast train pace would be sent up this futuristic beanstalk to deliver cargo and people into orbit and back.According to the International Space Elevator Consortium (), the cost of transporting cargo in this way ""will be significantly reduced in price to the realm of dollars per kilogram compared with over $20,000 per kilogram today.""This is an idea that could well become reality before the curtains are drawn on the 21st Century - in fact, Tokyo-based construction company Obayashi Corp. has stated plans to have a 96,000 kilometer (59,652 mile) space elevator capable of carrying 30 passengers at a time .Have we missed something? If you know of any mass transport concepts we've overlooked that have the potential to reinvent our urban and intercity journeys in the future, we'd love to hear your thoughts in the comments section.",Radical railways: Top 10 transportation systems of the future,https://newatlas.com/future-transport/22959/
