contents,titles,urls
"Lee Se-dol, a top-class Go player from South Korea, is known for his exceptional strategy and skills at the ancient board game, but at the same time, he is also known for his provocative comments toward his opponents. – That hasn’t changed even though this time, his challenger isn’t human.Lee, who has won 18 world titles, said on Monday that he is confident of beating Google’s artificial intelligence (AI) program AlphaGo. In a five-game match set for next month, the 32-year-old South Korean expects to win by a score of 5-0 or 4-1.“It didn’t take long for me to make the decision (to play) because I was so curious about AlphaGo,” Lee said Monday. “I only thought about five minutes (before accepting the offer).”The historic man-versus-computer showdown is scheduled for Mar. 9, 10, 12, 13 and 15 at the Four Seasons Hotel in Seoul. Demis Hassabis, the CEO of the AlphaGo developer Google DeepMind, said the algorithm’s programmer will place the markers on the board after watching AlphaGo’s moves from a monitor.The winner of the five-game challenge will receive US$1 million. If AlphaGo wins, the money will be donated to UNICEF and other charities.AlphaGo surprised the Go community after shutting out European Go champion Fan Hui 5-0 last October. But Lee, who went pro at the age of 12, said the result doesn’t make him nervous.“Looking at the match in October, I think (AlphaGo’s) level doesn’t match mine,” Lee said. “Of course, there would have been many updates in the last four or five months, but that isn’t enough time to challenge me.” However, Lee, who acquired Go’s highest level of ninth dan in 2003, acknowledged that any games against the AI will be very close in a few years.“If artificial intelligence continues to advance, probably in a year or two years, it will be really hard to guess the results,” he said.Go, known as “baduk” in South Korea, originated in China more than 2,500 years ago. It involves two players alternately putting black and white stones on a checkerboard-like grid. The object is to have larger territories than the opponent by surrounding vacant areas of the board using their stones.Fellow Go players have predicted that Lee will prevail against AlphaGo.“I was first surprised that an artificial intelligence program has advanced enough to challenge pro Go players,” said Lee Chang-ho, who has won 21 world Go events. “It will be an interesting matchup, but I think Lee Se-dol will win.” Yoo Chang-hyuk, a ninth dan Go player with 24 titles, including six international tournaments, offered a more careful prediction in the human brain versus computer algorithm matchup.“Lee Se-dol will have an easy win if AlphaGo’s level is the same as what was shown against Fan Hui,” Yoo said. “But we don’t know how much AlphaGo has progressed since then.”Ke Jie, the top Chinese player who defeated Lee last month, said the South Korean was “too modest” when he predicted a victory by 4-1 or 5-0.“I’m not perfectly sure about this, but I’m going to say that Lee would win by 5-0 according to that game (between AlphaGo and Fan Hui) last October,” Ke was quoted as saying by Xinhua News Agency. “It is said that AlphaGo is learning all the time… so it is hard to say what the AI would be like in three months. (But) barring any unforeseen circumstances, Lee would win anyway.”Ke predicted AI would eventually beat human players one day.“AI has been developing at a fast pace,” he said. “We the pros have paid a lifetime effort to reach the height we’ve got today, but we have to reconcile with it when the day comes.”Regardless of the result, scientists are saying the match marks a significant occasion where an AI can challenge a human brain, and it will lead to further advances in the development of human-like algorithms.“Now, just like humans, an AI can learn from experience and draw inferences to make up strategies,” said Jeong Jae-seung, a bio and brain engineering professor at the Korea Advanced Institute of Science and Technology (KAIST). “This matchup will open a new chapter in the history of AI regardless of the result.”(Yonhap)",S. Korean Go Player Confident of Beating Google’s AI,http://koreabizwire.com/s-korean-go-player-confident-of-beating-googles-ai/50339
"Korean researchers have developed Ultra Low Power (ULP) augmented reality (AR) glasses that can detect finger movement, allowing users to play a virtual piano or type with a virtual keyboard. – KAIST announced that Professor Yoo Hoi-joon and his team in the electrical engineering department developed ‘K-Glass 3’, which is a ULP AR smart glasses device that can recognize human body actions and movements.K-Glass 3 is the successor of the AR based K-Glass 1 developed in 2014, and K-Glass 2 developed in 2015, which can track eye movement. The new product was revealed at the International Solid State Circuits Conference held in San Francisco at the beginning of the month.The key technology of K-Glass 3 is the device’s stereo camera system. The system processes images obtained from two cameras, and extracts depth information, recognizing objects three dimensionally.With the system, users can type on a keyboard realized with the smart glasses and play a virtual piano, experiencing AR.The research team commented that there was no user interface (UI) or user experience (UX) to transfer text on the smart glasses prior to the recent development. They anticipate that smart glasses that detect motion will be useful to users that are used to text.K-Glass 3 runs on Ultra Low Power (ULP), and can be used for more than 24 hours on a single charge.AR devices prior to the K-Glass 3 used more than three watts of electric power due to complicated algorithms and motion-detecting sensors. It had been pointed out that the devices were difficult to adapt to the smart glasses system that used a battery equivalent to one fifth of the size of a smartphone.However, K-Glass 3’s stereo camera system realizes a stereo vision algorithm within a ULP processor, using an average of only 20 milliwatts of electric power, and stops operating when no motion is detected.The research team added that a more convenient and intuitive UI/UX should be developed, and UPL and downsizing should be implemented for the smart glasses market to actually replace smartphones.By Kevin Lee ()",Type on a Keyboard and Play Piano with AR Smart Glasses,http://koreabizwire.com/type-on-a-keyboard-and-play-piano-with-ar-smart-glasses/50470
"A KAIST professor has said artificial intelligence-based fact checkers could be more effective than humans in tackling fake news in the future.Professor Cha Mi-young, who teaches computing at the Korea Advanced Institute of Science & Technology (KAIST), said big-data efforts to quickly discover and prevent fake news from spreading are more important than ever in the age of automated journalism.According to a study Cha cited during a policy forum on Thursday, artificial intelligence-based fact checkers are able to identify fake news with an 80 percent accuracy rate, even better than humans.Cha spoke during the event ‘Dinner and 4.0′, a monthly research conference for the fourth industrial revolution at KAIST where professors give presentations to researchers and students.“Nearly half of the top 20 news articles on Facebook with the most likes during the 2016 U.S. presidential election turned out to be fake news. (Fake news) took advantage of the fact that most people just see a photo, or read a title or a lead, instead of clicking to read the full article,” Cha said.The widely shared notion that the most-clicked articles have high-quality content on online media outlets played into the hands of fake news, according to some analysts.According to Cha, fake news tends to attract views over a longer period of time than credible news, which is often read soon after its published.“Fake news tends to be spread among unlikely people, as they share it among each other sporadically.”It is thought that fake news tends to begin with sentences like, ‘I’ve heard it from somewhere,’ ‘It is not clear,’ or ‘According to someone,’ all of which avoid direct responsibility.During the conference, predictions were made for the future of the media, with some suggesting news could be graded on a scale of one to five based on credibility.“People might want real news, but also other types of news at the lower end of the credibility scale for entertainment purposes,” Cha said while laughing.“In a new era for the media where decisions are made automatically, such as robot journalism, big data research to swiftly identify fake news and stop it from spreading is becoming increasingly necessary,” Cha added.Hyunsu Yim (hyunsu@koreabizwire.com)","AI Fact Checker Will Tackle Fake News, KAIST Professor Says",http://koreabizwire.com/ai-fact-checker-will-tackle-fake-news-kaist-professor-says/100863
"A group of South Korean scientists have developed a way to detect major diseases such as cancer or diabetes through respiration, a feat which can bring a seismic change to the methods of diagnosing patient illnesses, Seoul’s science ministry said Thursday. – A research team at the Korea Advanced Institute of Science and Technology (KAIST) developed a sensor capable of analyzing components of patients’ respiration and providing details on their health conditions.The Ministry of Science, ICT, and Future Planning said the development, funded by the government, was made possible because gases emitted by patients include various volatile organic compounds that are possibly connected to different diseases.For example, a patient with diabetes tends to have more acetone in their breath. Previously, similar sensors failed to effectively find the substances selectively, as they only existed in small quantities.Traditional methods of disease diagnosis are blood testing or magnetic resonance imaging, which means that the new sensor can make such processes much easier, allowing patients to more promptly respond to their diseases.The sensor can also help patients keep track of their health through smartphones or other wearable devices.“(The sensor) can be applied in analyzing air pollution as well as other gas-detecting devices that connect to Internet of Things technology,” said KAIST professor Kim Il-Doo.The study is also posted on February’s material science journal “Small,” under the title “WO3 Nanofiber-Based Biomarker Detectors Enabled by Protein-Encapsulated Catalyst Self-Assembled on Polystyrene Colloid Templates.”(Yonhap)",S. Korean Scientists Develop Microsensors for Disease Diagnosis,http://koreabizwire.com/s-korean-scientists-develop-microsensors-for-disease-diagnosis/50830
"South Korean retailers’ race to automate their outlets is accelerating with leading industry players unveiling robots that can replace shop workers, market watchers said Wednesday. — On Tuesday, Korea Seven Co., the operator of convenience store chain 7-Eleven in South Korea, introduced a robot that allows customers to pay with their hands.Dubbed Veny, the robot scans users’ veins to verify their identity let them pay without cash or credit card, according to the company, an affiliate of South Korean retail giant Lotte.E-Mart Inc., a leading discount store chain operator under Shinsegae, has also showcased a robot that provides automated concierge service to shoppers.The robot concierge, Pepper, began a second round of test operation earlier in the day, after it was first revealed to the public for a three-week trial run in May.“We are continuing our research on ways to combine digital innovation with the retail scene,” said Park Chang-hyun, head of E-Mart’s S-Lab. “We will continue our work to improve convenience for our customers and provide them with an entertaining shopping experience.”Shinsegae has been carrying out a series of experiments to take a lead in the next-generation retail model.Earlier this month, E-Mart Everyday Inc., the group’s supermarket chain arm, launched a cashier-less store in Seoul where customers can pay with its mobile payment app without going through a checkout counter.In line with the latest automation trend, more retailers are joining hands with tech companies.Korea Seven’s Veny, for one, was created in collaboration with Lotte Data Communication Co., the information technology (IT) solutions unit of Lotte.“We are making efforts to adopt the latest technologies — including artificial intelligence and Internet of Things (IoT) — to seek transformation in businesses for our clients,” the IT firm’s CEO, Ma Yong-deuk, said.Last week, Hyundai Department Store Group signed a strategic collaboration agreement with Amazon Web Service Korea to analyze customer activity and expand the partnership between its IT arm and the local subsidiary of the U.S. retail giant.“It seems like the race to take the lead in an era of zero-effort commerce has begun among local retailers,” said Park Jin-yong, a professor at Seoul’s Konkuk University.The competition is gathering steam in part due to the government’s push to increase the minimum hourly wage, experts said.The country’s minimum wage spiked 16.4 percent on-year to 7,530 won (US$6.79) per hour at the start of the year. It is again set to jump 10.9 percent to 8,350 won per hour from the start of 2019.Some critics say the new cashier-less stores are still at a beginning stage, which is more close to self-service than automation.The E-Mart Everyday store, for one, requires visitors to scan the bar code of items on their own using their mobile phone. Security issues, such as shoplifting, remain a key challenge.“There is still much to be done before the retailers can actually commercialize these technologies. Nevertheless, the launch of these experiments is meaningful in that they clearly show where the companies are heading to and what they are pursuing,” said Lee Tae-eog, a professor at the Korea Advanced Institute of Science and Technology (KAIST).(Yonhap)",S. Korean Retailers Accelerate Push for Automation,http://koreabizwire.com/s-korean-retailers-accelerate-push-for-automation/123384
"As South and North Korea continue to reconcile their differences, those in South Korea’s media circles are working behind the scenes to resume exchanges with North Korean press halted more than a decade ago. — Experts also say it is essential to for South Korean journalists to meet with their North Korean counterparts on a regular basis to prevent inaccurate reports on North Korea.Dispatching South Korean journalists to the North is another suggestion aimed at minimizing such differences.Earlier attempts to promote exchange between the two Koreas in the media sector date back to 2002, when Yonhap News Agency and the Korea Broadcasting System (KBS) signed a cooperative agreement with the Korean Central News Agency and Korean Central Television, both North Korean state-owned media outlets.According to a source familiar with the situation, there were fewer speculative news reports during the Kim Dae-jung and Roh Moo-hyun administrations because the South-North exchange made it possible for South Korean journalists to check facts with the North.The source went on to say that “regular meetings” between both parties are important and the government must pave the way for this to happen.While South Korean media are completely excluded from access to the hermit kingdom, only two foreign press members have a presence in North Korea: Associated Press (AP) and Agence France-Presse (AFP).For South Korean journalists who have no choice but to rely on AP and AFP for sources on North Korean stories, gaining direct access to North Korean communication channels has been a long-sought dream.The Ministry of Unification has disclosed that a number of South Korean media outlets have applied to open up bureaus in the North Korean capital of Pyongyang but cautioned it was up to North Korea to accept and approve the applications.Experts say the media exchange between West and East Germany may serve as an example for similar exchanges between South and North Korea.According to Professor Kim Yeong-uk of KAIST, West and East Germany co-produced a current affairs program to help the public better understand pending issues.“Just as West and East Germany did, the two Koreas should actively pursue exchanges in the press,” Kim said.H. S. Seo (hsseo@koreabizwire.com)",South Korean Press Eager to Establish Presence in Pyongyang,http://koreabizwire.com/south-korean-press-eager-to-establish-presence-in-pyongyang/119720
"A small South Korean satellite designed to carry out space observation successfully reached its designated orbit after blasting off from an Air Force base in the United States, Seoul’s science ministry said Tuesday. — The Next Sat-1, which lifted off from the Vandenberg Air Force Base in California at around 10:34 a.m. Monday (local time) aboard the Falcon 9, made contact with ground stations, the Ministry of Science and ICT said.The 107-kilogram satellite, developed by the Korea Advanced Institute of Science and Technology (KAIST) from 2012-2018, reached its orbital altitude of 575 kilometers, an official said.The ministry said the Svalbard satellite station located in the Arctic Circle established initial contact followed by signals being received by KAIST in South Korea about six hours and 30 minutes after the launch, the ministry said.The ministry said all of the satellite’s solar panels have been deployed properly, allowing it to generate power.“The successful launch of the Next Sat-1 was possible not only due to endless efforts and passion of the KAIST researchers but also the help of researchers from all fields,” Choi Won-ho, a ministry official, told reporters in Seoul.Starting February, the satellite will measure space radiation and observe infrared light from the stars for two years, following a three-month period of preparations, officials said.The launch was first delayed when American rocket company SpaceX, founded by Elon Musk, extended an inspection of its two-stage rocket, the Falcon 9. The launch was further pushed back multiple times due to various weather conditions.It is a groundbreaking launch for SpaceX in numerous ways as not only is this the first time the company has reused the rocket for a third time but it is the biggest batch of satellites that has ever taken off on a single launch from U.S. soil.The Falcon 9 safely reentered the atmosphere and landed after about eight minutes of flight.Until now, practically all orbital rockets were disposable, meaning the rockets were discarded after launch. SpaceX has been reused twice.Experts forecast the launch would open the new horizons for spaceflight, with SpaceX hoping that the Falcon 9 rocket would be able make numerous trips into space, thus reducing costs.The rocket’s payload included 15 microsatellites and 49 CubeSats from both commercial and government entities, including 25 from international organizations.At present, South Korea operates four satellites for weather and Earth observation.(Yonhap)",S. Korean Satellite Successfully Reaches Earth’s Orbit,http://koreabizwire.com/s-korean-satellite-successfully-reaches-earths-orbit/128262
"English evolutionary biologist Richard Dawkins’ influential book “The Selfish Gene” is the most borrowed scientific literature from South Korean public libraries, with “Sapiens” by Israeli historian Yuval Noah Harari ranking third. — South Korean KAIST professor Chung Jae-seung’s edited and re-released edition of “Science Concert” was the second most sought after text in the top three most popular science books.The National Library of Korea analyzed the number of loaned out books in the science category by 660 public libraries over an approximate three year period, and it found “The Selfish Gene” was checked out 24,064 times. “Sapiens” was borrowed 20,659 times.A spokesperson from the National Library of Korea said, “Going by subject category, mathematics, liberal arts and biology were the most popular in that order. Works by English-speaking authors featured prominently in the most popular list of science novels.”Rounding out the top five most borrowed list of science books was Randall Munroe’s “What If?: Serious Scientific Answers to Absurd Hypothetical Questions” and Carl Sagan’s “Cosmos”.Lina Jang (linajang@koreabizwire.com)",“The Selfish Gene” Most Lent Out Science Book by Public Libraries,http://koreabizwire.com/the-selfish-gene-most-lent-out-science-book-by-public-libraries/116541
"A group of Vietnamese scientists who studied at science and technology institutions in South Korea have established a joint alumni association. — Korea University of Science and Technology (UST) said that Vietnamese scientists held an inauguration ceremony for the KOREA S&T (Science and Technology) Joint Alumni Association last Saturday in Hanoi, Vietnam.The association brings together all Vietnamese graduates or research fellows who studied at UST, the Korea Advanced Institute of Science and Technology (KAIST), the Gwangju Institute of Science and Technology (GIST), the Korea Institute of Science and Technology (KIST), and other institutions.More than 100 alumni, out of some 400 graduates in total, participated in the event.Moon Gil-ju, the dean of UST who first proposed the establishment of the association; Kim Soo-hyun, vice dean of KAIST; Moon Seung-hyeon, dean of GIST; and Geum Dong-hwa, dean of Vietnam-Korea Institute of Science and Technology also participated in the ceremony.“Vietnamese scientists who earned their degrees in South Korea, a leading nation in science and technology, have come together in this very place,” said Bui Ba Chinh, head of the Authorization Center at the Ministry of Science and Technology of Vietnam.“This will serve as an opportunity to stimulate closer exchange with the science and technology industry in South Korea.”“It is meaningful that graduates who have experienced science and technology in South Korea have gathered,” said UST dean Moon Gil-ju.“The occasion will help pave the way for deeper scientific and technological cooperation with Vietnam in accordance with our government’s New South Policy.”Kevin Lee (kevinlee@koreabizwire.com)",Vietnamese Scientists with S. Korean Degrees Establish Joint Alumni Association,http://koreabizwire.com/vietnamese-scientists-with-s-korean-degrees-establish-joint-alumni-association/127954
"Yonsei University plans to open up a new Department of System Semiconductor Engineering in 2021 that will offer graduates the guarantee of a job at Samsung Electronics Co. — The university and Samsung agreed early this week to create the new department and have notified the Ministry of Education. The first batch of students will be selected next year.The new department is a ‘contractual department’ that involves a university to engage in a contractual relationship with a company for its creation.The department trains its students based on a curriculum tailored to meet the company’s interest. In return, the company ensures 100 percent employment of all department graduates.Yonsei University’s Department of System Semiconductor Engineering will accept 50 students per class. Students will be provided with scholarships from Samsung, which will also hire them when they graduate.Yonsei and Samsung, while starting out with an undergraduate program, plan to eventually create a special program that will issue both bachelor’s and master’s degrees.SK hynix Inc., and other semiconductor manufacturers are teaming up with Seoul National University, Korea Advanced Institute of Science and Technology (KAIST), and other universities to create contractual departments similar to the one at Yonsei.For companies, contractual departments benefit them by training experts and professionals who are suited to their needs.Since a shortage of experts is one of the biggest problems faced by the semiconductor industry, manufacturers are eager to install contractual departments at universities to tackle the problem.Some critics, however, are concerned that such practices may turn universities into ‘job training schools.’Some argue that excessive flow of capital into universities may undermine the traditional role of universities as a platform to raise critical minds.Ashley Song (ashley@koreabizwire.com)",Yonsei University Creates New Department Guaranteeing Employment at Samsung Electronics,http://koreabizwire.com/yonsei-university-creates-new-department-guaranteeing-employment-at-samsung-electronics/136551
