contents,titles,urls
"South Korea is set to resume work on two nuclear reactors on the southeastern coast after a three-month hiatus, as a state commission gave the green light to complete construction Friday and which is expected to affect the government’s nuclear phase-out plan. — The construction of the Shin Kori-5 and Shin Korea-6 in Ulsan, 414 kilometers southeast of Seoul, has been put on hold since July 14 as the government wanted to assess public opinion to decide on their fate, the first such action taken by the country.The commission’s recommendation based on surveys of a 471-member civilian jury and several rounds of public debates relieved anxieties felt by local companies involved in the project. However, it is viewed as delaying the drive by Seoul to push forward its new renewable energy initiative to wean South Korea away from atomic energy.Although President Moon Jae-in pledged to abandon the project during the election campaign, local contractors and residents have strongly opposed the move and threatened to take legal action to obtain financial compensation.A consortium led by the state-run Korea Hydro & Nuclear Power Co. (KHNP) has already spent 1.6 trillion won (US$1.4 billion) on the project that began last year, with construction already being 30 percent complete.The KHNP said it will take the necessary steps to resume construction after the committee’s recommendation is accepted during a Cabinet meeting set for Tuesday.“Once we receive the official documents from the government, we will notify contractors of the decision and push for the resumption of construction based on changed contract terms, which were delayed due to the temporary suspension,” the KHNP said.The KHNP estimated the financial damage on local contractors to be about 100 billion and set out a plan to use reserve funds to compensate them.The intensely debated issue, which was decided by a margin of 19 percentage points in favor of resuming the work, highlights differing views between the government’s renewable energy push and established industries that prefer nuclear power to meet the country’s needs for cheap electric power.Those who support the reactors said the government should reflect the committee’s recommendation when it draws a broader energy roadmap, which is due later this year.“The construction was underway in accordance with the due process. Taking the issue to a public debate could hurt the credibility of the government’s policy,” Jung Yong-hun, a professor at Korea Advanced Institute of Science &amp; Technology (KAIST), said. “The committee’s call for resuming the construction sends a message that the government should reconsider its nuclear-free policy.”Although the three-month deliberative process focused on the fate of the two reactors under construction, experts stressed the need to continue open discussions on the future of the country’s energy policy.“I think there was consensus that aborting the project could create a huge fallout because such a move involves financial compensation and legal procedures, as well as employment problems,” Roh Dong-seok, a senior researcher at the Korea Energy Economics Institute, said.“As the committee sided with resumption (of construction), the government should come up with policies to ease public concerns. Public debates of far wider breadth and depth should continue on how to design the energy mix for a sustainable power supply.”South Korea relies on imported resources to meet 95 percent of its energy needs, while 24 reactors generate about 30 percent of its electricity.With four new plants nearly completed, the Moon administration has abandoned a plan to build four more and pushed for an early closure of the Wolsong-1 unit, now the nation’s oldest reactor.Although renewable sources like solar and wind have grown in popularity in recent years, experts say the local infrastructure and research levels are still in their early stages.They have urged the government to greatly expand investment in infrastructure for eco-friendly energy and ease regulations on new facilities, while calling for consistent policy implementation of long-term goal.(Yonhap)",Resumption of Construction for 2 Nuclear Reactors to Affect Gov’t Plan,http://koreabizwire.com/resumption-of-construction-for-2-nuclear-reactors-to-affect-govt-plan/98379
"A group of South Korean scientists have developed a new eco-friendly method to chemically produce terephthalic acid (TPA), which is largely used for polyethylene terephthalate, the science ministry said Sunday, a development that could be a boon in the mass production of next-generation industrial plastic. — TPA is a large-volume commodity chemical used principally as a monomer precursor in the manufacture of polyethylene terephthalate, which finds a broad range of applications in making beverage containers, films, and other applications. TPA is an important industrial chemical currently produced by the energy intensive and potentially hazardous p-xylene (pX) oxidation process.The team, led by Lee Sang-yeob at the Korea Advanced Institute of Science and Technology (KAIST), successfully designed a synthetic metabolic pathway converting pX to TPA, the Ministry of Science, ICT and Future Planning said.“Here we report the development of a metabolically engineered Escherichia coli system for biological transformation of pX into TPA,” the researchers said in a paper.“This research allows the production of eco-friendly plastic when serious issues such as climate change, environment issues and depletion of fossil fuels have arisen recently amid the rising demand for chemical products based on fossil fuels,” said Lee.“In this study, we report a biocatalytic process for the oxidation of pX to TPA by developing a metabolically engineered E. coli strain harboring a synthetically designed pathway,” the paper continued.Their findings were published in the latest edition of the journal “Nature Communications.”(Yonhap)",Scientists Develop New Method to Produce TPA,http://koreabizwire.com/scientists-develop-new-method-to-produce-tpa/84902
"The Korea Advanced Institute of Science and Technology (KAIST) said Monday its researchers have found how the novel coronavirus destroys lung cells by developing a “mini-lung” using stem cell technology. — The university said its team at the Graduate School of Medical Science and Engineering, and other researchers from the U.K.’s Cambridge University and Seoul National University Hospital, succeeded in developing a 3D human alveolar stem cell culture model, the world’s first, and used the mini-organ made from lung cells to reveal how the novel coronavirus impacts human lungs.KAIST, South Korea’s top science and technology university, said the joint team took on the project as research on coronavirus infections remained limited due to a lack of a lung cell model for laboratory settings, essential to develop treatment.The team exposed the “mini-lung” to severe acute respiratory syndrome coronavirus 2 (SARS-CoV-2), which leads to COVID-19, and found that the virus multiplied within six hours of exposure, leading to infection.The university said it took around three days for an innate immune response from the lung cells.Researchers also found that a single particle of the virus could be enough to infect one cell and that some cells drastically lost their function on the third day of infection.“If the 3D model is expanded in size, it can help research on various respiratory viral infections, including COVID-19,” Ju Young-seok, an associate professor at KAIST who headed the university’s research team, said.The joint research was published in the online version of scientific journal Cell Stem Cell on Thursday.The country’s National Institute of Health, the state-run Institute for Basic Science, and GENOMEinSight, a biomedical science firm run by Ju, also took part in the research, according to KAIST.Nearly 43 million COVID-19 cases have been reported globally as of Monday, according to data compiled by Johns Hopkins University.(Yonhap)",KAIST Develops ‘Mini-organ’ to Reveal How COVID-19 Damages Lungs,http://koreabizwire.com/kaist-develops-mini-organ-to-reveal-how-covid-19-damages-lungs/172803
"Hyundai Motor Co. said Thursday it will work with Israeli engineers to develop cutting-edge mobility technologies as demand for next-generation vehicles is on the rise. — The Korean carmaker will explore Israeli startups that have expertise in such areas as artificial intelligence, sensor fusion and cybersecurity for investment and joint development, Hyundai Motor said in a statement.To seek such a partnership with local firms, Hyundai Motor will establish the Open Innovation Center in Israel early next year, the company said.South Korea’s largest carmaker by sales announced its partner program with Israel at the 2017 Fuel Choices and Smart Mobility Summit, an annual event presided over by the Israeli government, held in the Middle East country from Tuesday to Wednesday.In September, Hyundai Motor signed a partnership with Israel’s biggest science and engineering university TECHNION, and South Korea’s public research university KAIST for joint studies in next-generation mobility technologies.Hyundai is seeking partnerships in Israel as the carmaker strives to secure a future growth driver amid changing customer demands in the automobile markets where carmakers are putting a bigger focus on emission-free and autonomous vehicles.Related to the drive to expand its presence abroad, Hyundai Motor on Wednesday opened its sixth motor studio designed to enhance its brand image and promote its vehicles in Beijing. It also has four motor studios in Korea and one in Moscow.(Yonhap)",Hyundai Motor to Work with Israeli Engineers in Mobility Technology,http://koreabizwire.com/hyundai-motor-to-work-with-israeli-engineers-in-mobility-technology/99850
"A research team at the Korea Advanced Institute of Science and Technology (KAIST) has developed an unmanned aerial vehicle with separately controlled wings.The researchers, led by professors Ha Dong-soo and Jo Cheon-sik, said on Thursday that they had developed a new drone that features main wings that be controlled separately, allowing for a smooth transition between vertical flight and level flight.Typically, drones are divided into two main groups, one with fixed wings and the other with propeller blades.Drones with fixed wings often use all-in-one wings to create lift by using air flow for better energy efficiency, but lack swiftness due to a large radius of gyration, whereas drones with multiple propellers lag behind on the energy efficiency front.Against this backdrop, Professor Ha’s team has invented a new type of drone that flies with twin separately controlled main wings, and also comes with a motor on its tail.According to the researchers, there are two ways to gain separate control of the wings.Support can be provided for the fuselage and wings of a drone, together as well as separately, or the sides of the fuselage can be employed as part of a control device to provide individual support to each wing.Professor Ha’s team took the former approach, creating a new drone with wings that can be controlled individually while an accompanying sensor attached to the body will help adjust the movement of the aerial vehicle.As a result, the new drone is capable of various movements often impossible for regular airplanes, such as a smooth transition between vertical flight and level flight, according to the researchers.Since 2016, the research team has been patenting its separate wing control method from an early stage of development in the U.S. and China as well as in South Korea.“Separate wing control system for small and medium-sized aerial vehicles have not been trialed even in leading countries. We hope to see (the new development) used in a wide range of fields including air transport, safety management and air weapons for military purposes,” Ha said. Ashley Song (ashley@koreabizwire.com)",KAIST Drone Pushes the Boundaries of Flight,http://koreabizwire.com/kaist-drone-pushes-the-boundaries-of-flight/106648
"When people hear the words “virtual reality” (VR), most would think of video games with awkward VR headsets. Some would think of “The Matrix,” the movie where the main character, Neo, realizes that his reality is actually a computer simulation and that the Matrix is a VR version of the world designed to keep the human race passive. — Only a few years ago, VR — which works by tracking a user’s head movements in a simulated three-dimensional world — was a niche business, as the gadgets were not only expensive but cumbersome to use.Now, numerous vendors, including big names in the industry such as Samsung Electronics Co. and Facebook-owned Oculus, have released cost-effective headsets and opened up new possibilities by expanding the market beyond the gaming and entertainment sectors to various industries ranging from automotive and military to health care.The Korea VR Festival 2017, which ran from Saturday to Wednesday at the Sangam Digital Media Complex business district in western Seoul, was a chance to experience the latest VR technologies and to take a glimpse at how virtual reality can impact ordinary lives now and in the future.The event, co-hosted by the Ministry of Science and the National IT Industry Promotion Agency (NIPA), brought together nearly 200 VR manufacturers and suppliers from both home and abroad.“Imagine doctors operating on a patient in a VR operating theater (where) they will be able to see the procedures in advance,” said Joo Il-young of mid-sized tech firm SolidEng Inc. “These far-fetched ideas that seem to be so far from reality are actually already happening today.”The company has joined forces with the country’s top engineering university, the Korea Advanced Institute of Science and Technology (KAIST), to apply VR technology to hip joint surgery. MRI data is used to build up a 3D image of a hip joint so that the advantages and disadvantages of various surgical methods can be examined before surgery actually takes place.“Doctors will be able to make surgical plans through the VR navigation system to confirm the optimal procedure,” said Joo, adding that this method can enhance a patient’s recovery by giving surgeons the ability to carry out trial runs.The country’s top-notch Seoul National University Hospital in Bundang, Gyeonggi Province, just south of the capital, is one of a few hospitals combining medicine and VR technology. For the first time in the country, the hospital has begun training medical staff with VR.The hospital said it provides surgical experience to their interns, who view recorded videos of real surgeries through headsets. VR training improves their initial skills, and a simulation-based tests make it possible to ensure the basic competency of junior surgeons before they actually proceed to treating patients.Increasingly a large number of carmakers are also using VR technology to test safety features, and to design their products to be as safe as possible and of the quality the customer expects before they actually hit the production line. Many manufacturers are starting to offer various VR-based services.Hyundai AutoEver, an IT arm of South Korea’s largest automaker Hyundai Motors Co., has joined with Z-storm Inc. to develop a VR program that allows people to sit inside a specific vehicle model without actually riding the car itself.The so-called “Digital Showroom” gives people a real steering wheel with which to drive the virtual car, allowing users to experience the model as if they were sitting in it. The company currently provides the VR experience for Hyundai’s latest subcompact SUV Kona and plans to add more models.The latest gathering was also an opportunity to see how the military is incorporating VR technology to train soldiers and other military personnel by giving them experiences ranging from vehicle and flight simulations to battlefield situations.The Korea Military Academy, which trains future officers, showcased a weapons simulator that reproduces real ballistic trajectories to improve the effectiveness of firearms training. The school has begun developing its indigenous VR technologies by working with the Ministry of Science and ICT.“I think simulating the actual battlefield for soldiers who will be facing combat is probably the most difficult area in which VR can prepare troops,” said Seo Jae-hoon, an ex-serviceman and businessman who tried the academy’s VR simulator.According to a report by industry tracker IHS, the global VR market is about to become mainstream and could surpass US$ 40 billion by 2020. Currently, VR hardware accounts for the largest share of the market, with the software sector forecast grow at the highest rate.Gaming and entertainment are currently still the most common uses for the medium. However, industry insiders say that other segments such as health care and industrial applications will be far bigger markets in the next five years.(Yonhap)",VR Tech Expands Scope Beyond Gaming to Cover Everyday Lives,http://koreabizwire.com/vr-tech-expands-scope-beyond-gaming-to-cover-everyday-lives/96264
"A group of South Korean scientists have developed an artificial intelligence-based processor that can be utilized for various deep learning technology, the ICT ministry said Monday. — According to the Ministry of Science and ICT, the team led by Yoo Hoi-jun of the Korea Advanced Institute of Science and Technology (KAIST) developed the neural network recognition processor that is more energy efficient compared with those in use today.Noticeably, the team’s processor delivered fourfold higher efficiency compared with Google Inc.’s Tensor Processing Unit (TPU), considered a front runner in neural network computations. The new processor can also deliver both convolutional and recurrent neural networks simultaneously.“It is meaningful that the research team developed the processor that can be activated at low power to realize the AI technology,” said Yoo, who is a professor of electrical engineering.The research was funded by the ministry and was announced during the annual International Solid-State Circuits Conference.(Yonhap)",Scientists Develop Energy-Efficient AI Processor,http://koreabizwire.com/scientists-develop-energy-efficient-ai-processor/112213
"The right timing for talking is more difficult than it appears. — This is because the context can differ depending on the mood of counterparts or the surrounding environment.A South Korean research team has developed a new artificial intelligence (AI) technology that enables AI assistants to know when it is an appropriate time to talk.The Korea Advanced Institute of Science & Technology (KAIST) announced on Wednesday that it found contextual factors in user circumstances that determine the optimal timing for smart speakers to talk.After developing smart speakers for experimental use, the research team installed them in the rooms of 40 students who live in campus dormitories and collected as many as 3,500 data records over a period of a week.As part of the experiment, the smart speakers asked if it was okay to talk when the user’s motion was detected or when a certain amount of time had passed. In response, the students answered and explained why.With this experiment, the circumstance contextual factors that determine when the smart speakers should start or stop talking were classified into personal factors, social factors and motion factors.Personal factors, for instance, can be divided into the degree of concentration on activities, the degree of urgency and busyness, the state of mental and physical condition, and the state of being able to talk or listen.The research team expects the new technology to contribute to developing new AI assistants that can offer preemptive services such as reminding users to take medication or modifying schedules based on the actual progress of planned tasks.Kevin Lee (kevinlee@koreabizwire.com)",New Technology Developed to Get AI Assistant Talk Timing Right,http://koreabizwire.com/new-technology-developed-to-get-ai-assistant-talk-timing-right/173316
"Those present at the Korea Advanced Institute of Science and Technology’s Fusion Hall (KAIST University) on November 2 were treated to an unusual spectacle that also doubled as a glimpse of a possible future. –  What the assorted gathering of students and interested onlookers were there to see was a virtual football competition “played” between two teams of AI, which were designed with the capacity for deep learning, a form of machine learning that was employed by Google DeepMind’s Alpha Go, the AI that famously beat Go grandmaster Lee Sedol in a five-game set last year.The game, featuring red and blue numbered blocks moving a soccer ball around a 2D field, was superimposed onto the wall. The competition was the first of its kind ever attempted; the closest comparison would be the “AI vs Human” battles that had occurred previously, namely the aforementioned “Google DeepMind Challenge Match” or the “Deep Blue vs Garry Kasparov” chess matches. Each football team was made up of five AI, who had learned to play with each other prior to the tournament. The preliminaries will take place throughout this month, after which the teams with the highest amount of goals scored will advance to the final round.An AI sportscaster and sportswriter were also showcased at the event. Both sides that developed the AI football teams had included an algorithm in the game that provided simultaneous running commentary and writeups.The university plans to turn the game into a global event going forward; it will extend an invitation to foreign schools next year with the support of various organizations.  Lina Jang (linajang@koreabizwire.com)","KAIST Hosts AI Football Competition, Showcases Sportswriting Capabilities",http://koreabizwire.com/kaist-hosts-ai-football-competition-showcases-sportswriting-capabilities/100070
"Aramco Asia Korea Ltd., a wholly owned subsidiary of Saudi oil giant Aramco, announced Friday it has signed a partnership deal with a foundation to provide coding programs to about 100 lower-income students in its latest social contribution. — MIDAM Scholarship Foundation plans to begin a yearlong program later this month to help bridge the educational gap in computer science among elementary and middle school students in Seoul and the central city of Daejeon, according to Aramco Asia Korea.The program will be provided online first due to the coronavirus pandemic. The foundation plans to offer an offline program, depending on the situation on the COVID-19 pandemic.Professors and university students majoring in computer science from major universities will participate as volunteer teachers.Fahad A. Al-Sahali, head of Aramco Asia Korea, said the programs are meant to ensure that underprivileged students are not left behind in computer science education.“Learning how to code is one of the essential skills that the future might require from students, and while we equip them with such skills, we aim to highlight the importance of protecting our planet,” he said in comments provided by the company.In March, Aramco Asia Korea donated 1 billion won for COVID-19 relief aid in South Korea.Aramco, the world’s largest oil company, is currently the top shareholder of S-Oil Corp., a major oil refiner operating in South Korea, with a 63.41 percent stake.(Yonhap)",Aramco Offers Coding Programs to Lower-income Students,http://koreabizwire.com/aramco-offers-coding-programs-to-lower-income-students/163746
"A South Korean research team has developed a new artificial-intelligence chip capable of deep learning that could be used in future mobile phones, robots and drones. The researchers, led by professor Yu Hoe-jun at the Korea Advanced Institute of Science & Technology, announced on Monday that they had revealed findings from their study last week at Hot Chips, a symposium on high performance chips which was held in San Jose.The semiconductor chip, also known as a deep neural network processing unit (DNPU), is capable of a number of AI-based tasks including object and action recognition as well as image captioning, which explains images in text, all of which fall under the category of deep learning.As part of machine learning, deep learning is technology that allows computers to learn things on their own, including recognizing the owner of a device, and turning images into text.The research team claims the energy efficiency of their DNPU is up to four times greater than the tensor processing unit which was used in Google’s famous AI computer program AlphaGo, which plays the board game Go.In addition, unlike a TPU, which relies on data center servers to process deep learning, the DNPU chip can complete the task from devices like mobiles, robots and drones.Hot Chips, where the findings from the study were first unveiled, is an academic platform where IT giants like Intel, Google and Microsoft have revealed groundbreaking advances.This year, KAIST and Harvard University took part in the symposium. Ashley Song (ashley@koreabizwire.com)",KAIST Develops New AI Chip Capable of Deep Learning,http://koreabizwire.com/kaist-develops-new-ai-chip-capable-of-deep-learning/93050
