contents,titles,urls
"Just past noon on a recent Monday, a 30-something woman entered a small brick-and-mortar shop in the heart of Seoul, the kind of commonly seen convenience store in South Korea that sells a little bit of everything. — Except, it was locked until the shopper tagged her credit card on a reader placed next to the door to get in. She had no human contact in the course of her visit that lasted three minutes or so, during which time she picked up some snacks, paid with her credit card and left.The shop at the Westin Chosun hotel is one of four unmanned convenience stores run by emart24, an affiliate of leading discount store chain operator Shinsegae, which opened in September amid local retailers’ efforts to find a breakthrough in the saturated market.While it mostly looks like any other 24-hour shop, a closer look reveals some differences between it and outlets with a clerk.There is no alcohol, and cigarettes are sold through a vending machine. Self-service kiosks, where guests scan the bar codes of their items, automatically reject products that are past their sell-by dates.The country’s first cashierless convenience store broke onto the retail scene in May, when 7-Eleven unveiled a shop that utilizes vein recognition technology at South Korean retail giant Lotte’s 123-story skyscraper.At present, only people using certain payment systems, such as credit cards issued by the business group’s financial arm, can enter the store after a prior registration.Automated stores belonging to emart24, on the other hand, allow access and payment with any credit card, though they could be more susceptible to robbery.BGF Retail Co., the operator of South Korea’s largest convenience store chain, CU, is also attempting to tap into the emerging business with a mobile application called CU Buy-Self, which allows customers to pay on their own.The app has been on a beta run at its outlet in Seongnam, south of Seoul, since last week and the company plans to expand the service nationwide by the first half of next year.“It currently plays a supportive role in running our store, but we believe it will ultimately be the starting point for the realization of cashierless convenience stores,” said Lee Eun-kwan, head of the company’s management innovation department.Industry watchers say it will take some time for the new type of stores to fully replace conventional ones, mainly due to security reasons.“It seems the new cashierless stores are still at a self-service stage, rather than an automation stage,” said industrial and systems engineering professor Lee Tae-eog at the Korea Advanced Institute of Science and Technology (KAIST).“Unless retailers find the technology to minimize the possibility of theft to near zero, they won’t be able to adopt the system nationwide,” he said.Indeed, emart24 operates a separate team at its headquarters to monitor the four unmanned stores 24 hours a day via CCTV.“We will focus on improving the overall system, including the security issues, before we roll out a further expansion plan,” an emart24 official said.Yet many experts say the appearance of such experimental shops is a sign of things to come and that it is about time to seriously talk about how to face the new era of automation and its effects on the job market.The race to take a lead in the next generation retail model is gathering steam in part because of the government’s push to increase the minimum hourly wage to 10,000 won (US$9.29) by 2020.In July, the government decided to raise the minimum wage by 16.4 percent to 7,530 won per hour next year, marking the biggest jump in nearly two decades.“For retailers, labor costs constitute a big part in running their businesses,” professor Lee said. “They cannot just sit idle when all the other competitors are putting more and more resources into automation,” he said.“There will be simply less work for humans to do, and those low-paid workers doing simple tasks will be the first to be hit,” the professor added.Lee Ga-hyun, who heads the Arbeit Workers’ Union, a civic group for part-time employees, urged the government to put more effort into protecting workers’ job security.“We held a couple of discussion sessions over the issue, and many of our members actually express concerns over whether they will be able to keep their positions and whether it will become more difficult to find a job,” she said.“Some people maintain an optimistic stance, saying new jobs will be created along the way, but it is still vague whether that work will be distributed to people of all strata,” the activist added.Lee Nam-sin, director of the Korean Contingent Workers’ Center, suggested that all relevant parties, including the government, sit down together and come up with a consensus on how and to what extent automation should be adopted.The director, who represented laborers at the trilateral council of labor, management and the general public for next year’s minimum wage negotiations, said all the burden will be placed on the workers in the absence of such talks.“The move for a more automated society is an irreversible trend at this point,” director Lee said. “The question is how to make a soft landing.”(Yonhap)",S. Korean Retailers Rev up Push to Expand Cashierless Stores,http://koreabizwire.com/s-korean-retailers-rev-up-push-to-expand-cashierless-stores/103185
"A South Korean research team has developed an eco-friendly generator that absorbs small amounts of water from the atmosphere to generate electricity. — Researchers at the Korea Advanced Institute of Science and Technology (KAIST) found that if a small amount of water (0.15 ml) is dropped on one side of cotton fiber coated with conductive carbon particles, the hydrogen ions in the water move from the wet side to the dry side, causing an electric current to flow.This is a principle in which a small amount of electrical energy is generated by the voltage difference caused by hydrogen ion absorption between wet and dry areas.Furthermore, the researchers found that since hydrogen ions move slowly, they can generate electricity for an hour before the cotton dries completely.Since all water evaporates, the generator eventually stops producing electricity, Thus, one must drop water periodically to keep generating electricity.In order to continuously supply water, researchers used calcium chloride, a deliquescent substance which absorbs water from the atmosphere and slowly dissipates.When a cotton fiber coated with carbon is covered with calcium chloride, it is found that the cotton will absorb moisture voluntarily in an environment with 20 percent humidity and maintain power.The researchers succeeded in turning on a 20mW LED light bulb with 0.15ml of water using a generator that was developed with the process mentioned.Unlike other eco-friendly power sources such as solar and wind, which are constrained by environmental factors, the research team explained that in environments with humidity of 20 percent or higher, electricity can be generated without adding any water.“The generator, including the deliquescent substance, has shown the ability to produce power for more than two weeks in a typical atmospheric environment,” said Kim Il-doo, the KAIST professor who led the research team.“This technology can be used for wearable devices that develop using sweat from our bodies and for power generators for the Internet of Things.”Kevin Lee (kevinlee@koreabizwire.com)",Eco-friendly Generator Produces Electricity from Water,http://koreabizwire.com/eco-friendly-generator-produces-electricity-from-water/149684
"New technology for an OLED mask that fits closely to the face has been developed by a South Korean research team. — A joint research team from the Korea Advanced Institute of Science and Technology (KAIST) and Seoul National University Bundang Hospital said Wednesday that it has developed a thin and flexible “freeform” OLED for phototherapy.Phototherapy is a treatment that uses light to promote internal biochemical reactions. LED masks and laser devices are major phototherapy devices.Although LED mask technology is receiving attention for its role in skin regeneration processes such as healing wounds and improving wrinkles, current LED masks have limitations.It is difficult to develop LEDs that distribute light uniformly and can adhere to the skin.The research team has produced freeform OLEDs that can adhere not only to the skin but also to cloth and paper by using displays that are thin, flexible and have uniform light-emitting properties.The new displays have a sandwich structure, with a thin OLED placed between two layers of thicker film, and can be attached to the surface of various materials as their overall thickness is 10 micrometers.Thin film layers were manufactured by combining barrier layers, plastics and adhesives that completely seal the display to protect from exposure to moisture and oxygen.The research team tested the freeform OLEDs on mice that had keratinocyte cells removed and then shone the light on them in 10-minute sessions. The results showed that the cells were 21 percent regenerated eight days later.The control group without any phototherapy did not regenerate any of the keratinocytes.In addition, as a result of applying freeform OLEDs to artificial skin models made of human skin cells, the skin that received phototherapy was more than 30 percent thicker than the control group that did not receive phototherapy.A thicker epidermis means skin has regenerated.The freeform OLEDs worked normally despite 1,000 repeated folds, and their lifespan was maintained for more than 1,000 hours after washing, the team explained.“The new OLEDs can be used in wearable devices for phototherapy attached to clothes or hats as well as mask packs for skin beauty and patches for healing wounds,” said KAIST professor Choi Kyung-cheol, who led the research team.Kevin Lee (kevinlee@koreabizwire.com)",Researchers Develop OLED Mask Technology,http://koreabizwire.com/researchers-develop-oled-mask-technology/149876
"New technology has been developed that allows diesel-powered delivery trucks to be equipped with hybrid engines that can increase fuel efficiency while reducing emissions. — The Cho Chun Shik Graduate School of Green Transportation at the Korea Advanced Institute of Science and Technology said Monday that it had completed a system that can carry electric batteries and a drive system in diesel engines for cargo trucks weighing less than 1.5 tons, which are typically used by parcel delivery companies.The research team succeeded in efficiently distributing power while modifying the manual transmission and making parts lighter.The researchers developed a thin drive motor and inserted the part into a narrow gap, about 14 centimeters between the engine and the transmission in the existing drive system.As a result of applying this technology to three trucks that are more than five years old, the change was hardly noticeable on the surface.The research team is currently conducting the first road tests on Jeju Island to confirm the safety of the technology. It is examining the quantity emissions as well as the impact of the mechanical changes on braking and steering.The researchers believe the system will ultimately improve combined fuel efficiency by 30 percent and reduce fine dust emissions by 20 percent. The goal is to commercialize the system at a cost of less than 5 million won (US$4,300) per vehicle.The research team is planning to carry out demonstration work at KAIST’s Environment-friendly Smart Auto Research Center by next year.“The vehicle weight increase for this highly efficient and eco-friendly technology does not exceed 100 kilograms,” said Kim Kyung-soo, Dean of the Cho Chun Shik Graduate School of Green Transportation.Kevin Lee (kevinlee@koreabizwire.com)",New Tech Transforms Diesel Delivery Trucks into Hybrid Vehicles,http://koreabizwire.com/new-tech-transforms-diesel-delivery-trucks-into-hybrid-vehicles/147573
"The actual Winter Games are at least a month away, but that hasn’t stopped the PyeongChang 2018 Winter Olympics from rewriting history right now. – On a chilly December day, the crowd gathered at the Korea Advanced Institute of Science and Technology (KAIST) in Daejeon were treated to an unusual sight; not one, but two robots serving as Olympic torch bearers.The first runner, DRC-HUBO, arrived on scene in the driver’s seat of a self-driving car with American roboticist Dennis Hong of UCLA riding shotgun. Wearing an Olympic flag-themed beanie on its head, HUBO was greeted to cheers and applause from the excited onlookers.A humanoid robot designed by a research collective called Team KAIST, HUBO can mimic a variety of human movements ranging from dancing to shaking a person’s hand. It brought itself and its engineering team global recognition when it took first place in the 2015 DARPA Robotics Challenge that was held from 2012 through 2015. By accomplishing eight tasks the fastest amongst all other contestants, HUBO raised the profile of South Korean robotics technology internationally. After Hong passed on the Olympic flame, HUBO pressed forward and successfully transported the fire to the next runner, its “father”, professor Oh Joon-ho, the leader of Team KAIST. Despite the obstacle that was placed in front of it as a test, HUBO maneuvered the roadblock with ease. HUBO was only one half of the spectacle on this day, as only a few dozen meters down the road stood a 270kg robot over 2 meters tall.Named the FX-2, what differentiated this robot from HUBO was the 14-year old young man sitting on the chair that composed the FX-2′s upper body. Designed specifically for the Winter Games according to the Olympics organizing committee, the FX-2 can be described simplistically as a giant walking chair with arms.Its predecessor, the FX-1, was of a similar build, but was limited in two key ways: It was built to move around indoors, and it did not have the two “data-arms” that the person in the passenger seat can control. These two arms can perform similar functions to that of human appendages, and are also equipped with five fingers each that can bend or flex. Lee Jung-jae, the pilot of the bot and the winner of a software development competition for youth, showed an example of these capabilities by shifting the Olympic torch from the robot’s left to right hand. The Olympic flame was eventually passed to the next human in line without incident.Broadcast live on YouTube and Facebook, the majority of comments regarding the two robots’ performance were positive, though some criticized the sounds the machines generated or South Korean robotics technology as “still far from where the United States is at”.S.B.W. (sbw266@koreabizwire.com)",History Made as Robots Carry Olympic Torch,http://koreabizwire.com/history-made-as-robots-carry-olympic-torch/104193
"SK hynix Inc., South Korea’s second-largest chipmaker, said Tuesday it has joined hands with the country’s leading research university to use artificial intelligence (AI) technology in the chip manufacturing process. — Under the memorandum of understanding with the Korea Advanced Institute of Science and Technology (KAIST), SK hynix will provide real-time data of its chipmaking process.KAIST will use its AI system to analyze the data and help the company to improve its product quality, according to SK hynix.It marks the first time in the country that a chipmaker is sharing its manufacturing data in real time.SK hynix said it launched a cloud system in March for data transmission and helped KAIST to set up separate working areas for security reasons.SK hynix has been trying to expand application of AI technology in chipmaking in recent years to process massive data.The company last year established the Machine Intelligence and Data Analytics Solutions (MIDAS) lab to set up an AI-powered system across various areas in the company.(Yonhap)",SK hynix Joins Hands with KAIST on Use of AI Tech in Chipmaking,http://koreabizwire.com/sk-hynix-joins-hands-with-kaist-on-use-of-ai-tech-in-chipmaking/159683
"A mask that can be reused and still maintain its filtering function after being washed more than 20 times has been developed. — Much attention is paid on whether the new mask filter can solve the problem mask shortages amid the growing coronavirus outbreak.A team of researchers from the Korea Advanced Institute of Science and Technology (KAIST) said Monday they have developed a nanofiber filter that maintains filter efficiency even after washing with an “Insulated Block Electrospinning” method that intersects or aligns nanofiber at right angles in a cross-shaped pattern.The existing melt blown filters are non-woven, randomly intertwined fibers, with varying pore sizes, and require multiple filters to be overlaid to block even small particles.In addition, static electricity formed on the surface of the fiber disappears when it touches moisture, and after a certain period of time, the efficiency of the filter decreases drastically when it is washed or worn.The new filter is made by crossing fine nanofiber at right angles or by tightly aligning fibers in a row, with smaller and equally spaced air holes.This allows the same blocking efficiency with less thickness than conventional filters. The masks are airy and make it easy to breathe as well.Even after washing with ethanol or soap several times, the particle blocking function was maintained.Although the team hand-washed the filter more than 20 times with soap and immersed it in an ethanol solution for more than three hours, the structure of the filter remained unchanged and the performance remained at 94 percent compared to the initial performance.Furthermore, the mask was still able to block particles better than a KF80 mask even after it was folded and bent more than 4,000 times.The team also developed cotton mask that can make use of the reusable filters.When considering the masks and filters can be washed with ethanol spray or soap and reused 10 to 20 times, people can live a month, or even longer, with two to three filters.A KAIST startup company established in February of last year can produce a filter sheet 35 centimeters wide and 7 meters long in an hour. Using this method, the company can manufacture an average of 1,500 mask filters per day.Professor Kim Il-doo of KAIST, who led the research team, said, “The mask can be reused with ethanol disinfection or light hand washing, which will solve the environmental problem caused by the loss of masks and the disposal of masks.”“We plan to expand the facilities for mass production by using related procedures such as approval from the Ministry of Food and Drug Safety,” he added.D. M. Park (dmpark@koreabizwire.com)",Researchers Develop Reusable Mask Filter,http://koreabizwire.com/researchers-develop-reusable-mask-filter/155636
"As more children are exposed to digital technologies from an early age, a growing number of tech-savvy parents are looking for toys that can help make their kids more creative and smarter. — After searching for an answer for a fun, easy and expandable toy, RoboRisen, a Korean robot startup, developed a smartphone-connected modular robot named PingPong: to serve as a playmate and a teacher for kids in a more engaging way.RoboRisen founder and CEO Yim Sang-bin said the single-module based platform can easily create hundreds of robots and provides an opportunity to enjoy entertainment at affordable prices.“My goal was to create an easy and fun robot that can be a lifelong friend for all ages,” Yim said during an interview with Yonhap News at the firm’s Seoul office.“As PingPong is an open platform, it can be transformed into any form depending on the users’ levels.”Yim, a former researcher of the KAIST (Korea Advanced Institute of Science and Technology) robot team, introduced PingPong earlier this year after two years of development and launched 13 educational kits for schools in August.The company plans to release a dozen more models via Wadiz, Korea’s largest crowdfunding platform, later this month to expand its customer base, he said.PingPong’s entry level cube starts at 55,000 won (US$46.40) and packages for coding and other software education cost around 140,000 won on a local e-commerce site.The 47-year-old robot scientist, who also runs a local education company supplying coding tools for about 2,000 schools over the past 12 years, decided to start a new business to create a robot that overcomes limitations of the current models used in schools.With his expertise in the robot industry and know-how in the educational toy market, Yim focused on a robot platform that can be used by all ages, ranging from kindergartens to colleges, and even for adult hobbyists.“Advanced models are expensive and complicated to assemble, while cheaper robot toys are too simple and make kids get easily bored with limited forms,” Yim said.“PingPong solved many technical problems by making it possible to construct running, crawling and walking robots with a single module and linkable to other platforms.”Each cube has a central processing unit (CPU), battery, motor and sensors. By combining cubes and links, the user is able to build any robot they want within several minutes, he said.Controlling hundreds of cubes with a single smartphone is also possible with Bluetooth networking technology, and users can charge them simultaneously with just one charging port.“We put in advanced technologies to make it simple and easy,” Yim said. “I would say it’s the pinnacle of minimalism.”The 36-millimeter square modules were designed to fit into the hands of his two sons, then aged 6 and 10 in 2017, the main target customer of the robot.“I was lucky to have potential customers at home, who now play well with the robots,” he said.Although the black-and-yellow cubic cell’s design is plain, users can make their own covers with a 3-D printer to decorate it or create links to connect with other modules.“With a 3-D printer, you can create different links between the modules and customize the cover design,” he said.Despite its foolproof structure, Yim said the robot can become an educational tool for advanced software courses in colleges as it is built on an open platform, the firm said.The startup has been talking applications for PingPong for an engineering course curriculum with faculty members at KAIST and the University of Oxford in England, while exploring ways to collaborate with LG Electronics Inc. to apply its artificial intelligence (AI) in its robot platform.“Expandability is important for educational robots used in schools to meet demands for different educational programs,” Yim said. “Starting at the beginner level, it can be used in curriculums for engineering college students.”The CEO said the company will focus on distributing the robot in local schools first and expand the presence in the global educational toy market.As part of efforts, RoboRisen will promote its robots in major tech and education fairs at home and abroad next year, including the Consumer Electronics Show (CES) in Las Vegas and the Mobile World Congress in Barcelona slated in the first two months of next year.Though still in an early stage in the market, PingPong has received several awards for its innovative design and engineering technology, including the CES 2020 Innovation Award.The company said it plans to release a full lineup of the robots and educational tool kits in collaboration with other partners, aiming to generate 50 billion won of sales by 2023.“I want to make PingPong a new standard in robot entertainment, software education and the robotics market,” Yim said.(Yonhap)",RoboRisen Targets Educational Toy Market with App-based Modular Robot,http://koreabizwire.com/roborisen-targets-educational-toy-market-with-app-based-modular-robot/149076
