contents,titles,urls
"At its meeting today, the Board decided on a package of further measures to support job creation and				the recovery of the Australian economy from the pandemic. With Australia facing a period of high				unemployment, the Reserve Bank is committed to doing what it can to support the creation of jobs.				Encouragingly, the recent economic data have been a bit better than expected and the near-term outlook				is better than it was three months ago. Even so, the recovery is still expected to be bumpy and drawn				out and the outlook remains dependent on successful containment of the virus.The elements of today’s package are as follows:Under the program to purchase longer-dated bonds, the Bank will buy bonds issued by the Australian				Government and by the states and territories, with an expected 80/20 split. These bonds will be bought in the secondary market through				regular auctions, with the first auction to be held this Thursday for Australian Government securities.				Further details of the auctions are provided in the accompanying market notice.The Bank remains prepared to purchase bonds in whatever quantity is required to achieve the 3-year				yield target. Any bonds purchased to support this target would be in addition to the $100 billion				bond purchase program.At today’s meeting, the Board also considered an updated set of economic forecasts. The global				economy has been recovering from the initial virus outbreaks, with the recovery most advanced in China.				Even so, output in most countries remains well short of pre-pandemic levels and recent virus outbreaks				pose a downside risk to the outlook, particularly in Europe.In Australia, the economic recovery is under way and positive GDP growth is now expected in the				September quarter, despite the restrictions in Victoria. It will, however, take some time to reach the				pre-pandemic level of output. In the central scenario, GDP growth is expected to be around				6 per cent over the year to June 2021 and 4 per cent in 2022. The unemployment rate				is expected to remain high, but to peak at a little below 8 per cent, rather than the				10 per cent expected previously. At the end of 2022, the unemployment rate is forecast to be				around 6 per cent.This extended period of high unemployment and excess capacity is expected to result in subdued				increases in wages and prices over coming years. In underlying terms, inflation is forecast to be				1 per cent in 2021 and 1½ per cent in 2022. In the most recent quarter,				year-ended CPI inflation was 0.7 per cent and, in underlying terms, inflation was				1¼ per cent.The Board views addressing the high rate of unemployment as an important national priority.				Today’s policy package, together with the earlier measures by the RBA, will help in this effort.				The RBA’s response is complementary to the significant steps taken by the Australian Government,				including in the recent budget, to support jobs and economic growth.The combination of the RBA’s bond purchases and lower interest rates across the yield curve will				assist the recovery by: lowering financing costs for borrowers; contributing to a lower exchange rate				than otherwise; and supporting asset prices and balance sheets. At the same time, the RBA’s Term				Funding Facility is contributing to low funding costs and supporting the supply of credit to the				economy. To date, authorised deposit-taking institutions have drawn $83 billion under this facility				and have access to a further $104 billion.Given the outlook for both employment and inflation, monetary and fiscal support will be required for				some time. For its part, the Board will not increase the cash rate until actual inflation is sustainably				within the 2 to 3 per cent target range. For this to occur, wages growth will have to be				materially higher than it is currently. This will require significant gains in employment and a return				to a tight labour market. Given the outlook, the Board is not expecting to increase the cash rate for at				least three years. The Board will keep the size of the bond purchase program under review, particularly				in light of the evolving outlook for jobs and inflation. The Board is prepared to do more if				necessary.There will be a press conference at 4:00pm AEDT today.",Reserve Bank of Australia announces interest rate decision 3 November,https://www.miragenews.com/reserve-bank-of-australia-announces-interest-rate-decision-3-november/
"Orange NAIDOC Week kicks off Sunday without the traditional street march but includes an online talent contest, the annual Harmony Cup, a golf day and an Elders Lunch.Orange NAIDOC Committee Chair Gerald Power said the celebration was scaled down this year due to COVID-19 but the spirit for the week was just as strong and vibrant as it was every year.“The national theme for this year’s NAIDOC Week is Always Was, Always Will Be.“As we reflect on and explore our nation’s history, all 65,000 years of history, our nation’s First Peoples navigated the land, farmed the land, studied and learned from the land,” Mr Power said.“The theme investigates how Aboriginal and Torres Strait Islander Peoples adapted to the changing environment, survived and thrived during drought, bush fires and rising sea levels. As well as looking at the innovative ways our First Peoples managed the land, such as fire stick farming.”Orange NAIDOC Week begins with a small group of local Elders, and community members participating in a smoking ceremony, flag raising ceremony and an official welcome on Monday, November 9.Instead of the traditional NAIROC Concert, school and dance groups are busy filming their performances for an online talent show, and our local soccer stars are cleaning their boots ahead of the Harmony Cup.The Harmony Cup is a soccer tournament, and festivities, between local Indigenous and multicultural teams, and includes Indigenous and multicultural dance and food.The Harmony Cup match is open for anyone to attend and is held November 8, from 11.30am to 3pm at Sir Jack Brabham Park.Orange Mayor Reg Kidd said, one of his favourite elements of the week-long event was the awarding of Completion of Year 12 Awards to local Indigenous teenagers.“I am pleased Orange City Council contributes to the presentation of these awards to our local Aboriginal and Torres Strait Islander Year 12s,” Cr Kidd said.“This year, 34 year 12 students in the Orange area identified as Aboriginal or Torres Strait Islander and given how this year was filled with more challenges than any other year 12 cohort has had to deal with, I am particularly proud of them for the efforts they have made this year.”Orange NAIDOC Committee member and Orange Councillor Stephen Nugent encouraged the community to head to the Orange Regional Museum to see the display of original paintings and prints by local and well known Indigenous artists.“Every year the NAIDOC street march is joined by hundreds of school children, preschools, child care centres, and members of the community, which shows how passionate and involved the community is with NAIDOC Week,” Cr Nugent said.“This year, see the Museum, head over to Sir Jack Brabham Park for the Harmony Cup and acknowledge the flag raising as it is livestreamed on Council’s Facebook page, and spend some time thinking about the meaning of NAIDOC Week as a way to celebrate this year.”",NAIDOC Week to celebrate Indigenous culture,https://www.miragenews.com/naidoc-week-to-celebrate-indigenous-culture/
"The Waroona West Volunteer Bush Fire Brigade has a purpose-built facility for the first time with the construction of a $868,000 new fire shed.The new facility was made possible with a $698,000 Emergency Services Levy contribution, $95,000 from the Shire of Waroona and $75,000 from Alcoa.The land for the new fire shed was donated by local farmers Mick and Helen Muir who lost their hay shed and much of their machinery in the 2016 Waroona bushfire. Their home was thankfully saved.The new facility has two appliances bays, toilets, a wet room, training room, communications room, kitchen and outdoor patio area.Emergency Services Minister Francis Logan joined the opening of the new facility on the weekend and also helped present long-service medals to several members of the brigade, which played a key role during the 2016 Waroona bushfire.Waroona Shire President Mike Walmsley, his son Tait and daughter Mackenzie, were among the six recipients of five-year service medals.As stated by Emergency Services Minister Francis Logan:“I’ve been to many bushfire shed openings around Western Australia, but it is especially pleasing when it is the first time that a brigade has had a purpose-built facility.“This new facility will make a big difference to the Waroona West Bush Fire Brigade, which has faced some of our State’s worst fires.“This new shed was made possible in large part due to the collective power of the Emergency Services Levy, which can give shires like Waroona the opportunity to have modern and long-lasting facilities that may be beyond existing budgets.“Congratulations again to the long-service medal recipients and to all the brigade members for their tremendous efforts over the years.”","New $868,000 station for Waroona West Bush Fire Brigade",https://www.miragenews.com/new-868-000-station-for-waroona-west-bush-fire-brigade/
"Police are appealing for assistance to locate a 16-year-old girl missing from Ipswich.She was last seen at Ipswich Hospital just after midday yesterday.Police and family hold concern for her welfare, given her young age and given she requires medication.The teenager is described as Caucasian, around 150cm in height, of a slim build with dark hair and brown eyes.She was last seen wearing a purple mid-drift top with short sleeves, ripped high waist jeans and black and white shoes with ticks on them.The 16-year-old also has a distinctive dream catcher belly button piercing.Anyone who has seen the teenager or has further information is urged to contact police.If you have information for police, contact  by providing information using the  24hrs per day at  or call .You can report information about crime anonymously to , a registered charity and community volunteer organisation, via  24hrs per day or call .",Police seek help to find missing girl at Ipswich 3 November,https://www.miragenews.com/police-seek-help-to-find-missing-girl-at-ipswich-3-november/
"– Sales     soar as radio spreads the word –When     Tourism Whitsundays and Wavemaker had the idea to use one of the most     famous voices in the world to celebrate one of Australia’s most spectacular     regions, they turned to SCA to make it happen.Wonders     of The Whitsundays has since been realised via a unique and     engaging radio campaign which heroes the voice famed for limitless     knowledge, accuracy and calm – Siri.The     voice of Siri is possibly the most recognised in the world, and a     little-known fact is that the woman behind this voice, Karen Jacobsen, is a     Queenslander, and a Whitsundays local. The idea forged by Tourism     Whitsundays and Wavemaker is now a campaign that is now making phones ring     and filling beds!“Being able to work with Karen on     an education and promotional campaign for the Whitsundays region brought a     level of believability to all the airtime – because she’s the voice of Siri     and because she’s a Whitsundays local,” said Tony Byrne, Head of Creative     at The Studio at SCA Brisbane, who managed the campaign creative.“The     campaign had two major objectives: to showcase the accessibility and     affordability of the Wonders of The Whitsundays through engaging     audio creative following the devastation that COVID-19 has brought to the     industry, and to highlight the unique experiences the region offered.”Tourism     Whitsundays Chief Executive Officer Tash Wheeler said that as a not for     profit organisation, Tourism Whitsundays is always trying to stretch     marketing investments to ensure as much reach as possible.“I     believe that is exactly what we’ve achieved by investing in advertising     with SCA as part of our Wonders of The Whitsundays campaign. Our     industry needed a direct tactical approach, and these radio ads using Karen     Jacobsen the voice of Siri, are delivering incredible results for an industry     that so desperately needs it,” she said.“We     are thrilled with the results we’ve seen so far, with the industry     reporting sales in excess of $500,000 directly from the Wonders of The     Whitsundays campaign. The campaign has driven 13,700 quotes for travel     and over 430 bookings to date.”Byrne added: “SCA is playing an     instrumental role in helping Queensland tourism get back on its feet after     COVID-19, and this level of localism, with a very distinct international     flavour, delivered a real sense of excitement to listeners.“It’s another example of how SCA     offers businesses and industry bodies creative audio selling solutions, not     just airtime and a VO!”LISTEN HERE – ",Siri celebrates Wonders of Whitsundays in hit Queensland campaign,https://www.miragenews.com/siri-celebrates-wonders-of-whitsundays-in-hit-queensland-campaign/
"Southern Cross University’s Indigenous Events Coordinating Committee is proud to support NAIDOC organisers in celebrating and acknowledging a history that dates back thousands of generations.NAIDOC Week 2020 at Southern Cross University runs from 8 – 15 November. The theme for the North Coast region is hearing, seeing and learning about those who have cared for this country for more than 65,000 years.This year offers a busy program including popular online workshops to help understand some of the local languages from the University’s campus regions including Bundjalung, Gumbaynggirr and Yugambeh.Guided by local Elders, participants will learn how to pronounce words that relate to places, animals and body parts.“Unfortunately, COVID restrictions limit the number of people who can join the workshops but there are many other events that are also being hosted online,” said Janine Dunleavy from Gnibi College of Indigenous Australian Peoples.“We invite you to register and link with community events for what promises to be a diverse and fascinating week of NAIDOC activities.”For language workshops and other events, register at: gnibi@scu.edu.auThe University is also co-hosting a special Thursday Night Live! edition to celebrate NAIDOC, facilitated by Koori Mail General Manager Naomi Moran. Naomi will be joined by Elders Uncle Rob Bryant, Uncle Des Williams, Uncle Herb Roberts, Aunty Robyne Bancroft and Aunty Gwen Hickling, as they share their stories of connection to Country, culture, and community, addressing the theme for NAIDOC 2020 – Always Was, Always Will Be.Thursday Night Live! is an evening of provocation, discussion and dialogue, a partnership event of Southern Cross University and the Lismore Regional Gallery.NAIDOC week is a national celebration with exhibitions and story-telling events held in every state and territory.","Always Was, Always Will Be. – It’s all about NAIDOC week",https://www.miragenews.com/always-was-always-will-be-it-s-all-about-naidoc-week/
"The Government’s plan under Environment Minister Matt Kean to introduce a carbon tax will drive up taxation in the State whilst driving down economic activity, according to leader of the Shooters Fishers and Farmers Party, Robert Borsak.“Matt Kean has announced that this Government is going to tax New South Wales businesses into a green economy,” said Mr Borsak.“That can only mean one thing- a carbon tax- which means more tax for the people of New South Wales, less economic activity and the world’s highest priced electricity to boot.“This Government thinks it can spend its way into prosperity.“We’ve already got some of the highest electricity prices in the world and they want to ratchet this up a few notches just to kill any last prospect of an industry led economic recovery.“This will cost manufacturing, farming, and big and small business across the board. If you use power – it will cost you, and it will cost the jobs that we so desperately need right now,” said Mr Borsak.Mr Borsak’s comments come after the release of the pro-renewable paper by the left-wing think tank group, Blueprint Institute, controlled by Liberal powerbroker Michael Photios.“The NSW government is clearly in the open control of a Leftist faction run by a lobbyist,” Mr Borsak said.“This isn’t, and probably never was a true conservative, economically focused, pro-business Liberal/National government. It is more interested in the areas of policy traditionally covered by Labor and the Greens.“They have set up their own ‘think tank’, that is staffed by cronies, supplying sham papers to justify the spending of taxpayer’s money, and increasing taxes.“The unfettered ability for this Government to just spend, spend, spend, under the cover of the Covid19 pandemic, allows these crony socialists unlimited access to the Treasury of New South Wales.“With the integrity of this Government at an all-time low, it’s hardly surprising that they would take the lead on this from vested interests and lobbyists.“Berejiklian is the front and centre of this thrust to the heart of business and the bush.“By her very life experience, she doesn’t know or understand what it takes to grow a crop, fight a fire or go without water and an income. Let alone run a small business, pay wages, payroll tax, land tax or indeed incur any of the business risks that come with the territory of creating real economic activity, employment, long term wealth and jobs.“This Liberal/National Government is going to crush New South Wales under the burden of green taxes at a time when we’ve got record debt, record unemployment and rural towns on their knees. It’s simply mind boggling that a new tax would be considered at a time like this” said Mr Borsak.",Berejiklian Government Propose New Green Tax,https://www.miragenews.com/berejiklian-government-propose-new-green-tax/
"The RBA’s decision to cut interest rates to new historic lows and start a new round of quantitative easing is a vote of no confidence in the Government’s recovery plans, Greens Economic Justice spokesperson Nick McKim says.“This decision shows the RBA has no faith in the Liberals’ agenda of tax cuts for the super wealthy and more handouts for the big corporate polluters,” Senator McKim said.“Cutting rates to 0.1 per cent and $100 billion of quantitative easing is a sign that the RBA knows that things will continue to worsen for the economy because of deliberate decisions taken by Scott Morrison and Josh Frydenberg.”“It suggests that the RBA expects tax cuts will be saved rather than spent, as they were last year before COVID hit.”“The RBA wouldn’t need to be going to such extremes if the Government was actually trying to fix the economy by investing serious money in green infrastructure and setting income support above the poverty line.”“Australians face more difficult times ahead unless the Liberals dramatically change course and start investing for the future, and ensuring a decent quality of life for all.”“Under this government, printed money that should pump prime the economy is instead likely to inflate the housing market.”“This will be doubly so if responsible lending laws are overturned.”“The double-whammy of cheap money and looser lending standards is a recipe for an even bigger housing bubble.”",RBA lodges a vote of no confidence,https://www.miragenews.com/rba-lodges-a-vote-of-no-confidence/
,Rate cut decision comes at a time of rising global uncertainty,https://www.miragenews.com/rate-cut-decision-comes-at-a-time-of-rising-global-uncertainty/
"Ahead of World Tsunami Awareness Day, NSW State Emergency Service (NSW SES) is reminding communities along the state’s coast that, despite their rare occurrence, tsunamis are a still possibility.NSW SES Commissioner Carlene York said with World Tsunami Awareness Day happening on Thursday 5 November, it was timely to remind people living along the state’s coast to be aware of their risks.“There have been about 40 tsunamis recorded in NSW since 1805, so they can happen,” Commissioner York said.“With more than one million people living along our state’s coast, it is really important they not only know their risks but be prepared.”Commissioner York said all the resources that communities need is available via the NSW SES website.“Our website has details on how people can prepare, including how to tell when a tsunami is coming and where people need to go in order to be safe,” Commissioner York said.“We want all communities to be familiar with our website and use the resources available.“Whether it be to prepare for a storm, flood or tsunami, I encourage everyone to visit ses.nsw.gov.au and learn about your risks,” she said.","Don’t forget, NSW SES responds to tsunamis too",https://www.miragenews.com/don-t-forget-nsw-ses-responds-to-tsunamis-too/
"The outcome of a review into the Brahminy program is an indictment on Roger Jaensch’s handling of child safety.Shadow Minister for Child Safety Josh Willie said the main recommendations of the review are to put in place safeguards, support and oversight that should have already existed.“The recommended safeguards should have been in place before a single Tasmania child was put into this program.“What’s deeply concerning is that Roger Jaensch has only acted to look into the program when persistent concerns were raised by Labor and the Tasmanian media.“Roger Jaensch has been shamed into action after his mishandling of this issue. He acted only when this became an issue for him personally in the parliament and in the media.“The review has also recommended establishment of a Tasmanian program for at-risk children.“Again, Roger Jaensch is being pushed into action because he hasn’t had the political will or courage to develop a program in Tasmania.“It remains firmly Labor’s view that the right place for these at-risk children is in a Tasmanian program, and we urge the government to waste no further time making that happen.”Josh Willie Shadow Minister for Child Safety",Government shamed into action on Brahminy,https://www.miragenews.com/government-shamed-into-action-on-brahminy/
,Minister Adams statement on arrest of opposition activists and lawmakers in Hong Kong,https://www.miragenews.com/minister-adams-statement-on-arrest-of-opposition-activists-and-lawmakers-in-hong-kong/
"Police have charged a 55-year-old man following an incident in Walloon on November 1.The man was shot by police in the leg, after a siege which started the night prior at a Kingsley Street address.He was taken to Princess Alexandra Hospital with non-life-threatening injuries where he underwent surgery.The man has since been charged with three counts each of serious assault of a police officer and dangerous conduct with a weapon.He has also been charged with two counts of acts intended to cause grievous bodily harm.The Walloon man is next due to appear in the Ipswich Magistrates Court this month.Investigations by the Ethical Standards Command are continuing.Anyone with further information is urged to contact police.If you have information for police, contact  by providing information using the  24hrs per day at  or call .You can report information about crime anonymously to , a registered charity and community volunteer organisation, via  24hrs per day or call .",Police update 2: Man shot after Walloon siege,https://www.miragenews.com/police-update-2-man-shot-after-walloon-siege/
"The Department of Health has reported no new cases of COVID-19 in Western Australia overnight.The State’s positive COVID-19 case total stands at 770. To date 738 people have recovered from the virus.WA Health is monitoring 23 active cases in hotel quarantine. Four of these are off the AL Messilah livestock carrier which remains berthed at Fremantle Port.The AL Messilah and the Key Integrity are scheduled to clear quarantine on 5 November.Yesterday 660 people presented to WA COVID-19 clinics – 645 were assessed and 644 swabbed.There have been 495,932 COVID-19 tests performed in WA. Of those tested, 83,479 were from regional WA.Visit WA Health’s  website for the latest information on COVID-19.",South Australia coronovirus update as at 3 November,https://www.miragenews.com/south-australia-coronovirus-update-as-at-3-november/
                            The Cricket Australia Code Of Conduct Register for the 2020-21 season is below.                      The Cricket Australia Code Of Conduct Register for the 2020-21 season is below.,Code of Conduct Register 2020-21,https://www.miragenews.com/code-of-conduct-register-2020-21/
